{
  "schema": "glossa.usages/v1",
  "application": "fixture",
  "commit": "0123456789abcdef0123456789abcdef01234567",
  "branch": "main",
  "tool": {"name": "fixture", "version": "0.0.0"},
  "usages": [
    {"key": "cart.one", "file": "src/größe.ts", "line": 10, "column": 21, "kind": "t"},
    {"key": "cart.pretzel", "file": "src/größe.ts", "line": 8, "column": 53, "kind": "t"},
    {"key": "cart.size", "file": "src/größe.ts", "line": 7, "column": 77, "kind": "t"},
    {"key": "cart.tab", "file": "src/größe.ts", "line": 9, "column": 22, "kind": "t"},
    {"key": "cart.two", "file": "src/größe.ts", "line": 10, "column": 40, "kind": "t"}
  ]
}
